Task ID,Task Name,Description,Priority,Status,Due Date,Assigned To,Created By,Creation Date,Last Updated,Tags,Dependencies,Estimated Effort (Hours),Actual Effort (Hours),Completion Percentage,Notes,Category,Category,Location,Meeting Link,Attachments,Blockers,Risk Level,Risk Description,Resolution Plan,Notifications Enabled,Reminder Date,Color Code,Custom Field 1,Custom Field 2
TASK573,Design Task Calendar View,Visualize tasks over time in a calendar UI,Medium,To Do,02-07-2025,Celestine Gray,David Black,22-04-2025,,,UX,6,18,,calendar_ui_design.fig,Server Management,System Administration,Online,Online,Yes,30-06-2025,Low,Task Planning,Timeline View,,,,Sprint 3 Review,Budget Spent
TASK574,Optimize Backend Queries,Reduce DB load by optimizing slow SQL calls,High,In Progress,22-06-2025,Fable Cruz,Bob Green,22-04-2025,27-04-2025,,,30,27,Online,,Database Design,Database,Online,Online,Use query analyzer tools.,Yes,Low,Task Planning,Performance,Database Tuning,,,Pipeline Setup,Budget Remaining
TASK575,Conduct Security Pen Test,Third-party penetration testing for vulnerabilities,High,To Do,10-07-2025,Irie Emerson,Charlie White,22-04-2025,,,Security,16,6,,pen_test_agenda.pdf,Competitive Analysis,Market Research,Online,Online,Yes,08-07-2025,Low,App Security,Pentest 2025,,,,Round 2,Quality Score
TASK576,Build Notification Engine,Backend system for personalized task notifications,Medium,To Do,29-06-2025,Renan James,Jane Smith,22-04-2025,,,Backend,19,18,,notif_engine_spec.docx,Data Visualization,Data Analytics,Online,Online,Yes,27-06-2025,Medium,Systems,Notification Engine,,,,Performance Tuning,Support Ticket Number
TASK577,Run Load Test Suite,Stress test app for concurrency and response,Medium,To Do,20-06-2025,Oceane Parker,David Black,22-04-2025,,,QA,10,23,,load_test_plan.yaml,Task Tracking  ,Project Management,Online,Online,Yes,18-06-2025,Medium,Load Testing,Stress Sim,,,,Collateral Update,Customer Satisfaction
TASK578,Enable Dark Mode,Implement light/dark theme toggle,Low,To Do,30-06-2025,Bodric Vaughn,Eve Grey,22-04-2025,,,Frontend,50,24,,dark_mode_theme.fig,User Authentication  ,User Accounts,Online,Online,Yes,28-06-2025,High,UI Options,Dark Theme,,,,Sprint 4,Marketing ROI
TASK579,Validate Email Deliverability,Ensure system emails reach inbox not spam,Medium,To Do,25-06-2025,Kaia Reed,Charlie White,22-04-2025,,,Ops,11,6,,deliverability_test.xlsx,Content Marketing  ,Marketing,Online,Online, DKIM, DMARC.,High,UI Options,#795548,Ops Tools,Email Check,,CI/CD,Deployment Date
TASK580,Configure CDN Caching,Improve asset delivery speed globally,High,To Do,18-06-2025,Merrick Holt,David Black,22-04-2025,,,Infrastructure,12,30,,cdn_config_steps.md,Backend Development  ,Development,Online,Online,Yes,16-06-2025,Low,Infrastructure,Asset Delivery,,,,Feedback Analysis,Task Duration
TASK581,Add Task Priority Filters,Enable filtering by priority on dashboard,Low,To Do,19-06-2025,Alina Frost,Eve Grey,22-04-2025,,,UX,18,16,,priority_filter_spec.fig,Software Development  ,Technical,Online,Online,Yes,17-06-2025,Low,UX Features,Filter UX,,,,Mobile App Project,Team Collaboration Level
TASK582,Create System Health Monitor,Build dashboard showing uptime and metrics,High,In Progress,28-06-2025,Inara Steele,Jane Smith,22-04-2025,28-04-2025,,,27,19,Online,,Server Management  ,System Administration,Online,Online,Set alerts for thresholds.,Yes,Low,UX Features,Monitoring,Health UI,,,Sales Enablement,User Growth Impact
TASK583,Launch Referral Program,Reward users for inviting new users,Medium,To Do,30-06-2025,Talon Wren,John Doe,22-04-2025,,,Marketing,6,10,,referral_rules.docx,Database Design  ,Database,Online,Online,Yes,28-06-2025,Medium,User Growth,Referral Campaign,,,,Sprint Planning,Data Privacy Level
TASK584,Update Mobile UI Components,Use latest UI kit for consistency,Low,To Do,01-07-2025,Lucienne Frost,Alice Brown,22-04-2025,,,Mobile,18,50,,mobile_ui_kit_update.fig,Competitive Analysis  ,Market Research,Online,Online,Yes,29-06-2025,Medium,Mobile Design,UI Refresh,,,,Gateway Integration,Performance Metrics
TASK585,Analyze Task Completion Trends,Find patterns in how users complete tasks,Medium,To Do,03-07-2025,Briarson Ray,Bob Green,22-04-2025,,,Analytics,23,11,,task_trend_analysis.csv,Data Visualization  ,Data Analytics,Online,Online,Yes,01-07-2025,High,User Insights,Task Behavior,,,,User Journey,Documentation Status
TASK586,Automate Weekly Reports,Send automatic summary of completed tasks,Medium,To Do,23-06-2025,Calyx Emerson,David Black,22-04-2025,,,Automation,24,12,,weekly_report_script.py,Task Tracking  ,Project Management,Online,Online,Yes,21-06-2025,High,Reporting,Task Summary,,,,Real-Time Features,Customer Segment
TASK587,Refactor Legacy Code,Modernize old modules for maintainability,High,In Progress,27-06-2025,Oriana Vaughn,Alice Brown,22-04-2025,28-04-2025,,,6,18,Online,,User Authentication  ,User Accounts,Online,Online,Refactor in sprints.,Yes,Low,Reporting,Code Maintenance,Legacy Cleanup,,,UI Refresh,Growth Opportunity
TASK588,Setup Feedback Widget,Collect feedback from every page,Low,To Do,26-06-2025,Magnus Flynn,Jane Smith,22-04-2025,,,UX,30,27,,widget_feedback_ui.fig,Content Marketing  ,Marketing,Online,Online,Yes,24-06-2025,Low,User Feedback,Inline Widget,,,,Campaign Planning,Product Type
TASK589,Conduct User Interviews,Qualitative research for pain points,Medium,To Do,29-06-2025,Tierney Ellis,Charlie White,22-04-2025,,,Research,16,6,,user_interview_guide.pdf,Backend Development  ,Development,Online,Online,Yes,27-06-2025,Low,User Research,Interview Round 2,,,,Internal Wiki,Service Level Agreement (SLA)
TASK590,Implement Role-Based Access,Control user permissions by role,High,To Do,05-07-2025,Valkyr Bennett,David Black,22-04-2025,,,Security,19,18,,rba_design_spec.pdf,Software Development  ,Technical,Online,Online, User, Viewer.,Medium,User Research,#673AB7,Access Control,RBAC,,User Engagement,Product Lifecycle Stage
TASK591,Archive Inactive Tasks,Auto-archive old completed tasks,Low,To Do,24-06-2025,Zayla Pierce,John Doe,22-04-2025,,,Product,10,23,,task_archive_policy.docx,Server Management  ,System Administration,Online,Online,Yes,22-06-2025,Medium,Task Clean-up,Archive Logic,,,,Search Marketing,Revenue Impact
TASK592,Introduce Smart Suggestions,Use ML to recommend next tasks,High,To Do,08-07-2025,Amiran Hart,Bob Green,22-04-2025,,,AI,50,24,,smart_suggest_algo.pdf,Database Design  ,Database,Online,Online,Yes,06-07-2025,High,Smart Assistant,AI Suggestions,,,,Feature Management,Feature Maturity
TASK593,QA Checklist Revision,Update test checklist with recent modules,Medium,To Do,21-06-2025,Thorne Hayes,Alice Brown,22-04-2025,,,QA,11,6,,qa_checklist_v2.xlsx,Competitive Analysis  ,Market Research,Online,Online,Yes,19-06-2025,High,Quality Assurance,Checklist Update,,,,Code Quality,User Adoption Rate
TASK594,Setup Weekly Standups,Automate calendar invites for team standups,Low,To Do,17-06-2025,Aviendha Storm,Jane Smith,22-04-2025,,,Management,12,30,,standup_invites.ics,Data Visualization  ,Data Analytics,Online,Online,Yes,15-06-2025,Low,Team Rituals,Daily Sync,,,,DB Optimization,API Integration Status
TASK595,Localize UI for Spanish,Translate UI for Spanish users,Medium,To Do,06-07-2025,Lorien Brooks,Charlie White,22-04-2025,,,Localization,18,16,,spanish_locale.json,Task Tracking  ,Project Management,Online,Online,Yes,04-07-2025,Low,Global Reach,Spanish Version,,,,Productivity,Configuration Type
TASK596,Add Custom Task Fields,Allow users to define extra task metadata,Medium,To Do,02-07-2025,Evra Monroe,Eve Grey,22-04-2025,,,Customization,27,19,,custom_field_spec.docx,User Authentication  ,User Accounts,Online,Online, text, tags.,Low,Global Reach,#FF5722,User Customization,Task Fields,,Mobile Design,Access Level
TASK597,Enhance Onboarding Tour,Improve walkthrough for new users,Low,To Do,28-06-2025,Ciri Maddox,Bob Green,22-04-2025,,,UX,6,10,,onboarding_flow_v3.fig,Content Marketing  ,Marketing,Online,Online,Yes,26-06-2025,Medium,User Onboarding,Tour V3,,,,Report Automation,Error Rate
TASK598,Sync with Google Calendar,Allow 2-way calendar sync,High,To Do,04-07-2025,Zevius Blake,John Doe,22-04-2025,,,Integration,18,50,,gcal_sync_api.md,Backend Development  ,Development,Online,Online,Yes,02-07-2025,Medium,Productivity,Calendar Sync,,,,UI Kit,Maintenance Window
TASK599,Setup Backup Schedule,Daily backups for user data,High,To Do,27-06-2025,Liora Wells,Charlie White,22-04-2025,,,Infrastructure,23,11,,backup_policy.docx,Software Development  ,Technical,Online,Online,Yes,25-06-2025,High,System Safety,Data Backup,,,,Sentiment,User Retention Rate
TASK600,Review Team OKRs,Q2 review for alignment and progress,Medium,To Do,30-06-2025,Maelis Camden,Alice Brown,22-04-2025,,,Management,24,12,,q2_okrs_review.docx,Server Management  ,System Administration,Online,Online,Yes,28-06-2025,High,Team Planning,Q2 Goals,,,,Chrome Plugin,Customer Acquisition Cost (CAC)
TASK601,Update Project Timeline,Revise the project schedule based on recent progress and roadblocks,High,In Progress,29-04-2025,Onora Quinn,Jane Smith,18-04-2025,21-04-2025,"Project Planning,Timeline",TASK006,6,4,70,Need to incorporate feedback on staging deployment.,Task Scheduling,Scheduling,Online,Online,project_timeline_v2.mpp,None,Medium,Potential slippage due to deployment issues.,Re-evaluate dependencies and allocate buffer time.,Yes,27-04-2025,#FF8A65,Milestone Review,Gantt Chart Updated
TASK602,Develop User Profile Page,Implement the frontend and backend logic for user profile management,High,In Progress,05-05-2025,Cai Lennox,Bob Green,18-04-2025,22-04-2025,"Development,Frontend,Backend",TASK017,30,25,83,Integrating with authentication service.,User Authentication,User Accounts,Local,Online,user_profile_schema.json,None,Low,Minor UI alignment issues.,Address during final testing.,Yes,03-05-2025,#4CAF50,Sprint 4,Data Validation Required
TASK603,Run A/B Tests on Landing Page,Experiment with different versions of the landing page to optimize conversion rates,Medium,To Do,12-05-2025,Nysa Palmer,Charlie White,18-04-2025,,,"Marketing,A/B Testing,Web",16,16,,0,Content Marketing,Marketing,Local,Online,,landing_page_variants.pdf,Medium,Minor UI alignment issues.,Traffic volume might affect test duration.,Ensure sufficient traffic before concluding tests.,Yes,10-05-2025,UI Refresh,Conversion Optimization
TASK604,Implement Role-Based Access Control,Secure the application by implementing different access levels for various user roles,High,To Do,19-05-2025,Keira Vaughn,David Black,18-04-2025,,,"Development,Backend,Security",19,25,,0,Backend Development,Development,Local,Online,,rbac_design.docx,Medium,Minor UI alignment issues.,Potential security vulnerabilities if not implemented correctly.,Thorough testing and code review required.,Yes,17-05-2025,Sprint 4,Authorization
TASK605,Create API Documentation (v2),Update the API documentation to reflect the latest changes and new endpoints,Low,In Progress,26-05-2025,Valen Cruz,Eve Grey,18-04-2025,23-04-2025,"Documentation,API",TASK012,10,7,75,Documenting the new authentication methods.,Software Development,Technical,Online,Online,api_spec_v2.yaml,None,Low,Keeping documentation up-to-date with development.,Automate documentation generation where possible.,Yes,24-05-2025,#9E9E9E,API Reference,Version 2
TASK606,Monitor System Performance,Continuously track key performance indicators (KPIs) of the application,Medium,Monitoring,02-06-2025,Hesper Reign,Alice Brown,19-04-2025,24-04-2025,"Operations,Monitoring,Performance",TASK021,50,Ongoing,90,Setting up alerts for critical thresholds.,Server Management,System Administration,Online,Online,monitoring_dashboard_link.url,None,Low,Potential for performance degradation over time.,Regular optimization and scaling efforts.,Yes,31-05-2025,#673AB7,System Health,KPI Dashboard
TASK607,Design Database Backup Strategy,Plan and document the procedures for regular database backups and recovery,Medium,To Do,09-06-2025,Seraphin West,John Doe,19-04-2025,,,"Database,Backup,Recovery",11,8,,0,Database Design,Database,Online,Local,,backup_strategy_draft.docx,Medium,Potential for performance degradation over time.,Risk of data loss without a robust backup plan.,Implement and test backup and recovery procedures.,Yes,07-06-2025,Admin Tool,Data Security
TASK608,Conduct Competitive Analysis,Research and analyze the features and strategies of competitor products,Low,Completed,25-04-2025,Lyanna Rhodes,John Doe,19-04-2025,23-04-2025,"Market Research,Analysis",,12,12,100,Compiled a report summarizing key findings.,Competitive Analysis,Market Research,Online,Local,competitive_analysis_report.pdf,None,Low,Data accuracy and completeness.,Cross-reference with multiple sources.,Yes,23-04-2025,#795548,Market Intelligence,Competitor Landscape
TASK609,Integrate Third-Party Analytics,Implement tracking and analytics tools to gather user behavior data,Medium,In Progress,16-05-2025,Oisin Pierce,Alice Brown,19-04-2025,25-04-2025,"Development,Analytics,Integration",TASK017,18,14,78,Configuring event tracking and custom reports.,Data Visualization,Data Analytics,Online,Local,analytics_integration_plan.docx,None,Low,Ensuring data privacy compliance.,Anonymize user data where necessary.,Yes,14-05-2025,#009688,User Tracking,Data Insights
TASK610,Prepare End-of-Sprint Report,Summarize the progress  achievements  and challenges of the current sprint,Medium,To Do,23-05-2025,Bellamy Ray,Jane Smith,19-04-2025,,,"Agile,Reporting,Sprint",27,8,,0,Task Tracking,Project Management,Online,Online,,sprint_review_notes.docx,Low,Ensuring data privacy compliance.,Accurate representation of sprint outcomes.,Conduct a thorough sprint review meeting.,Yes,21-05-2025,Feature Type,Sprint Retrospective
TASK611,Automate Deployment Process,Implement scripts and tools to automate the application deployment pipeline,High,To Do,30-05-2025,Iskra Lane,Bob Green,20-04-2025,,,"DevOps,Automation,Deployment",6,20,,0,Continuous Integration/Continuous Deployment (CI/CD),DevOps,Online,Online,,deployment_scripts.zip,Medium,Ensuring data privacy compliance.,Potential for errors in automation scripts.,Thorough testing of the automation process.,Yes,28-05-2025,Priority,CI/CD
TASK612,Conduct User Interviews (Round 2),Follow up with users to gather more in-depth feedback on specific features,Medium,To Do,06-06-2025,Faryn Dean,Alice Brown,20-04-2025,,,"User Research,Interviews",18,12,,0,Unit Testing,Testing,Online,Remote,,interview_guide_round2.docx,Low,Ensuring data privacy compliance.,Scheduling conflicts with participants.,Offer flexible scheduling options.,Yes,04-06-2025,Department / Team,Feedback Analysis
TASK613,Optimize Mobile App Performance,Identify and implement performance improvements for the mobile application,Medium,To Do,13-06-2025,Silvain Vaughn,Bob Green,20-04-2025,,,"Development,Mobile,Performance",23,15,,0,Backend Development,Development,Online,Local,,mobile_profiling_report.pdf,Medium,Ensuring data privacy compliance.,Battery drain and slow loading times.,Optimize code and resource usage.,Yes,11-06-2025,Status,Mobile App Project
TASK614,Refine Sales Materials,Update brochures  presentations  and other sales collateral with the latest product information,Low,To Do,20-06-2025,Zuriella Knox,Charlie White,20-04-2025,,,"Sales,Marketing Materials",24,10,,0,Lead Generation,Sales,Online,Local,,sales_brochure_draft.pdf,Low,Ensuring data privacy compliance.,Maintaining brand consistency.,Review all materials with the marketing team.,Yes,18-06-2025,Owner / Assignee,Sales Enablement
TASK615,Plan Next Sprint Backlog,Collaboratively define the tasks and priorities for the upcoming development sprint,High,To Do,28-05-2025,Riven Tate,David Black,20-04-2025,,,"Agile,Planning,Sprint",35,8,,0,Task Tracking,Project Management,Online,Online,,sprint_planning_agenda.docx,Low,Ensuring data privacy compliance.,Ensuring clear and achievable sprint goals.,Conduct a well-facilitated sprint planning meeting.,Yes,26-05-2025,Sprint / Milestone,Sprint Planning
TASK616,Finalize Payment Gateway Integration,Complete setup and testing for the selected payment provider,High,In Progress,15-05-2025,Kaelen Frost,Bob Green,21-04-2025,25-04-2025,"Development,Payments",TASK034,12,6,50,Pending validation from QA team.,API Integration,Integration,Online,Online,payment_gateway_config.docx,None,High,Incorrect configurations may lead to failed transactions.,Perform test transactions and monitor logs.,Yes,13-05-2025,#8BC34A,Tags / Labels,Gateway Integration
TASK617,Design Onboarding Flow,Create UI/UX designs for new user onboarding,Medium,To Do,01-06-2025,Thistle Hart,Charlie White,21-04-2025,,,"Design,UX,UI",26,15,,0,UX/UI Design,Design,Online,Online,,onboarding_wireframes.fig,Low,Incorrect configurations may lead to failed transactions.,User drop-off during onboarding.,Use progressive disclosure for onboarding.,Yes,30-05-2025,Platform,User Journey
TASK618,Test WebSocket Implementation,Ensure real-time updates using WebSocket API are reliable,High,To Do,25-05-2025,Kesslyn Monroe,David Black,21-04-2025,,,"Testing,WebSocket,Real-Time",29,10,,0,Quality Control,QA,Online,Online,,websocket_test_plan.docx,Medium,Incorrect configurations may lead to failed transactions.,Failure to deliver messages in real-time.,Conduct stress testing and fallback plans.,Yes,23-05-2025,Impact Area,Real-Time Features
TASK619,Revamp Admin Dashboard,Improve usability and visibility of key metrics in the admin panel,High,In Progress,18-05-2025,Soren Maddox,Bob Green,21-04-2025,24-04-2025,"UI/UX,Admin Panel",TASK030,20,10,50,Awaiting design review.,Data Dashboards,Dashboard,Online,Online,admin_dashboard_mockup.fig,None,Medium,Cluttered layout reduces usability.,Simplify layout and highlight KPIs.,Yes,16-05-2025,#CDDC39,Customer Facing,UI Refresh
TASK620,Create Marketing Calendar,Plan marketing campaigns and events for Q3 2025,Medium,To Do,10-06-2025,Maika Drew,Alice Brown,21-04-2025,,,"Marketing,Planning",13,10,,0,Content Marketing,Marketing,Online,Online,,marketing_calendar_q3.xlsx,Low,Cluttered layout reduces usability.,Overlap with product deadlines.,Coordinate with PMs and Sales.,Yes,08-06-2025,Estimated Effort,Campaign Planning
TASK621,Build Internal Wiki,Centralize knowledge base and documentation for internal teams,Low,In Progress,20-06-2025,Aven Sinclair,John Doe,21-04-2025,24-04-2025,"Knowledge Management,Documentation",TASK032,18,7,40,Structure outline is ready.,Intranet Development,Internal Tools,Online,Online,wiki_structure.md,None,Low,Duplicate documents across teams.,Standardize formats and templates.,Yes,18-06-2025,#9E9E9E,Release Version,Internal Wiki
TASK622,Integrate Feedback Widget,Add a floating feedback form on key screens,Medium,To Do,05-06-2025,Jorah Brooks,Charlie White,21-04-2025,,,"UX,Feedback,Forms",37,6,,0,Usability Testing,UX,Online,Online,,feedback_widget_design.fig,Low,Duplicate documents across teams.,Low engagement rate.,Use incentives and ensure visibility.,Yes,03-06-2025,Requires Validation,User Engagement
TASK623,Conduct SEO Audit,Review site structure and content for SEO improvements,Medium,To Do,31-05-2025,Selene Cruz,Alice Brown,21-04-2025,,,"SEO,Audit,Marketing",12,8,,0,Content Marketing,Marketing,Online,Online,,seo_audit_report.docx,Medium,Duplicate documents across teams.,Low ranking for target keywords.,Revise meta tags and content strategy.,Yes,29-05-2025,Initiative Type,Search Marketing
TASK624,Set Up Feature Flag System,Enable toggling features for testing and phased releases,High,To Do,20-05-2025,Dax Vaughn,Eve Grey,21-04-2025,,,"DevOps,Release Control",36,14,,0,Continuous Integration/Continuous Deployment (CI/CD),DevOps,Online,Online,,feature_flags_setup.pdf,High,Duplicate documents across teams.,Live bugs due to incomplete toggles.,Test thoroughly in staging.,Yes,18-05-2025,Tech Stack / Integration,Feature Management
TASK050,Refactor Legacy Code,Improve performance and readability of outdated modules,Medium,To Do,15-06-2025,Ilaria Scott,Bob Green,21-04-2025,,,"Development,Refactoring",28,25,,0,Backend Development,Development,Online,Online,,legacy_refactor_log.md,Medium,Duplicate documents across teams.,Risk of introducing bugs.,Incremental refactoring and code reviews.,Yes,13-06-2025,Use Case / Objective,Code Quality
TASK051,Optimize Database Indexes,Review and optimize slow DB queries,High,In Progress,01-06-2025,Romaric Steele,David Black,22-04-2025,25-04-2025,"Database,Performance",TASK050,12,5,45,Indexes missing on key tables.,Process Optimization,Optimization,Online,Online,db_indexes_plan.sql,None,High,Slow task loading in dashboard.,Add composite indexes where needed.,Yes,30-05-2025,#4CAF50,Project Phase,DB Optimization
TASK052,Automate Daily Reports,Setup automation for daily team performance reports,Medium,To Do,28-05-2025,Yvaine Rivers,John Doe,22-04-2025,,,"Automation,Reporting",16,10,,0,Resource Allocation,Operations,Online,Online,,daily_report_script.py,Low,Slow task loading in dashboard.,Manual reports take too much time.,Use CRON and email delivery.,Yes,26-05-2025,Visibility,Productivity
TASK053,Design Mobile App UI,Create UI for iOS and Android versions,High,To Do,20-06-2025,Kiran Flynn,Eve Grey,22-04-2025,,,"Design,Mobile",44,20,,0,UX/UI Design,Design,Online,Online,,mobile_app_ui.fig,High,Slow task loading in dashboard.,UI inconsistency across platforms.,Create reusable design components.,Yes,18-06-2025,Regulatory Impact,Mobile Design
TASK054,Implement Sentiment Analysis,Integrate ML model to analyze task sentiment,High,To Do,10-06-2025,Tamsin Hayes,Charlie White,22-04-2025,,,"AI,ML,NLP",8,15,,0,Machine Learning Algorithms,AI Engine,Online,Local,,sentiment_model.pkl,High,Slow task loading in dashboard.,Negative sentiment ignored in overdue tasks.,Flag tasks with negative emotions.,Yes,08-06-2025,Data Involved,AI Features
TASK055,Develop Chrome Extension,Enable task capture directly from browser,Medium,To Do,15-06-2025,Orin Blake,Jane Smith,22-04-2025,,,"Browser Extensions,Tools",10,16,,0,API Integration,Integrations,Online,Online,,chrome_ext_manifest.json,Medium,Slow task loading in dashboard.,Limited capture options.,Add smart capture and screenshot.,Yes,13-06-2025,Release Readiness,Extensions
TASK056,Host User Feedback Webinar,Gather insights from power users,Low,To Do,25-05-2025,Saela Quinn,Alice Brown,22-04-2025,,,"Community,Engagement",12,8,,0,Content Marketing,Marketing,Online,Online,,webinar_plan.pdf,Low,Slow task loading in dashboard.,Low turnout rate last time.,Promote via in-app banners.,Yes,23-05-2025,Customer Impact Level,Community Building
TASK057,Setup Error Logging System,Centralize all error reports and logs,High,In Progress,22-05-2025,Callum Frost,David Black,22-04-2025,24-04-2025,"Monitoring,Logging",TASK041,10,3,40,Stack traces inconsistent.,Performance Monitoring,Monitoring,Online,Online,log_config.yaml,None,High,Hard to debug issues quickly.,Use structured logging format.,Yes,20-05-2025,#F44336,Testing Required,Logs
TASK058,Redesign Settings Page,Improve usability and layout of account settings,Medium,To Do,05-06-2025,Vionnet Lane,Bob Green,22-04-2025,,,"UI/UX,Settings",40,12,,0,UX/UI Design,Design,Online,Online,,settings_page.fig,Low,Hard to debug issues quickly.,Too many options on one screen.,Group features into categories.,Yes,03-06-2025,Persona / User Role,UI Revamp
TASK059,Add Push Notification Support,Notify users for due/overdue tasks,Medium,To Do,30-05-2025,Zephyrine Dean,Charlie White,22-04-2025,,,"Notifications,Mobile,Web",53,14,,0,Push Notifications,Notifications,Online,Online,,push_config.json,Medium,Hard to debug issues quickly.,Users missing reminders.,Add daily summary option.,Yes,28-05-2025,Design Status,Reminders
TASK060,Train Random Forest Model,Improve prediction for task urgency and success,High,To Do,10-06-2025,Eithan Vaughn,David Black,22-04-2025,,,"Machine Learning,AI",54,18,,0,Machine Learning Algorithms,AI Engine,Online,Local,,rf_model_v2.pkl,High,Hard to debug issues quickly.,Model overfits large tasks.,Balance dataset and tune parameters.,Yes,08-06-2025,Marketing Support Needed,AI Model
TASK025,Design Onboarding Flow,Create UI/UX designs for new user onboarding,Medium,To Do,01-06-2025,Ruelle Monroe,Charlie White,21-04-2025,,,"Design,UX,UI",26,15,,0,UX/UI Design,Design,Online,Online,,onboarding_wireframes.fig,Low,Hard to debug issues quickly.,User drop-off during onboarding.,Use progressive disclosure for onboarding.,Yes,30-05-2025,Analytics Tracked,User Journey
TASK061,Write Contributor Guidelines,Set clear rules for external contributors,Low,To Do,20-05-2025,Tarian West,Eve Grey,22-04-2025,,,"Documentation,Open Source",15,6,,0,Technical Documentation,Documentation,Online,Online,,contrib_guide.md,Low,Hard to debug issues quickly.,PRs without descriptions.,Enforce templates and format rules.,Yes,18-05-2025,Retrospective Notes,Open Source
TASK062,Implement Task Export Feature,Allow export to CSV/Excel for reporting,Medium,To Do,05-06-2025,Nimah Rhodes,Jane Smith,22-04-2025,,,"Data Export,Reporting",22,10,,0,Backend Development,Development,Online,Online,,export_tasks_spec.pdf,Low,Hard to debug issues quickly.,Exported files lack time info.,Include timestamps and IDs.,Yes,03-06-2025,Dependency / Blocker,Utilities
TASK063,Audit User Permissions,Ensure role-based access across all modules,High,In Progress,25-05-2025,Pax Carter,Charlie White,22-04-2025,25-04-2025,"Security,Access Control",TASK038,14,5,45,Roles not enforced in some endpoints.,Role-Based Access Control (RBAC),Authorization,Online,Online,permissions_matrix.xlsx,None,High,Data leaks due to open access.,Review all routes and roles.,Yes,23-05-2025,#E91E63,Budget Impact,Permission Audit
