Task ID,Task Name,Description,Priority,Status,Due Date,Assigned To,Created By,Creation Date,Last Updated,Tags,Dependencies,Estimated Effort (Hours),Actual Effort (Hours),Completion Percentage,Notes,Category,Category,Location,Meeting Link,Attachments,Blockers,Risk Level,Risk Description,Resolution Plan,Notifications Enabled,Reminder Date,Color Code,Custom Field 1,Custom Field 2
TASK433,Refactor Legacy Code,Improve performance and readability of outdated modules,Medium,To Do,15-06-2025,Zayden Knox,Bob Green,21-04-2025,,,"Development,Refactoring",28,25,,0,Backend Development,Development,Online,Online,,legacy_refactor_log.md,Medium,Duplicate documents across teams.,Risk of introducing bugs.,Incremental refactoring and code reviews.,Yes,13-06-2025,Use Case / Objective,Code Quality
TASK434,Optimize Database Indexes,Review and optimize slow DB queries,High,In Progress,01-06-2025,Mavis Storm,David Black,22-04-2025,25-04-2025,"Database,Performance",TASK050,12,5,45,Indexes missing on key tables.,Process Optimization,Optimization,Online,Online,db_indexes_plan.sql,None,High,Slow task loading in dashboard.,Add composite indexes where needed.,Yes,30-05-2025,#4CAF50,Project Phase,DB Optimization
TASK435,Automate Daily Reports,Setup automation for daily team performance reports,Medium,To Do,28-05-2025,Quinlan Hayes,John Doe,22-04-2025,,,"Automation,Reporting",16,10,,0,Resource Allocation,Operations,Online,Online,,daily_report_script.py,Low,Slow task loading in dashboard.,Manual reports take too much time.,Use CRON and email delivery.,Yes,26-05-2025,Visibility,Productivity
TASK436,Design Mobile App UI,Create UI for iOS and Android versions,High,To Do,20-06-2025,Elara Wren,Eve Grey,22-04-2025,,,"Design,Mobile",44,20,,0,UX/UI Design,Design,Online,Online,,mobile_app_ui.fig,High,Slow task loading in dashboard.,UI inconsistency across platforms.,Create reusable design components.,Yes,18-06-2025,Regulatory Impact,Mobile Design
TASK437,Implement Sentiment Analysis,Integrate ML model to analyze task sentiment,High,To Do,10-06-2025,Briony Clark,Charlie White,22-04-2025,,,"AI,ML,NLP",8,15,,0,Machine Learning Algorithms,AI Engine,Online,Local,,sentiment_model.pkl,High,Slow task loading in dashboard.,Negative sentiment ignored in overdue tasks.,Flag tasks with negative emotions.,Yes,08-06-2025,Data Involved,AI Features
TASK438,Develop Chrome Extension,Enable task capture directly from browser,Medium,To Do,15-06-2025,Ronan Steele,Jane Smith,22-04-2025,,,"Browser Extensions,Tools",10,16,,0,API Integration,Integrations,Online,Online,,chrome_ext_manifest.json,Medium,Slow task loading in dashboard.,Limited capture options.,Add smart capture and screenshot.,Yes,13-06-2025,Release Readiness,Extensions
TASK439,Host User Feedback Webinar,Gather insights from power users,Low,To Do,25-05-2025,Calypso Moon,Alice Brown,22-04-2025,,,"Community,Engagement",12,8,,0,Content Marketing,Marketing,Online,Online,,webinar_plan.pdf,Low,Slow task loading in dashboard.,Low turnout rate last time.,Promote via in-app banners.,Yes,23-05-2025,Customer Impact Level,Community Building
TASK440,Setup Error Logging System,Centralize all error reports and logs,High,In Progress,22-05-2025,Oren Sage,David Black,22-04-2025,24-04-2025,"Monitoring,Logging",TASK041,10,3,40,Stack traces inconsistent.,Performance Monitoring,Monitoring,Online,Online,log_config.yaml,None,High,Hard to debug issues quickly.,Use structured logging format.,Yes,20-05-2025,#F44336,Testing Required,Logs
TASK441,Redesign Settings Page,Improve usability and layout of account settings,Medium,To Do,05-06-2025,Veda Bennett,Bob Green,22-04-2025,,,"UI/UX,Settings",40,12,,0,UX/UI Design,Design,Online,Online,,settings_page.fig,Low,Hard to debug issues quickly.,Too many options on one screen.,Group features into categories.,Yes,03-06-2025,Persona / User Role,UI Revamp
TASK442,Add Push Notification Support,Notify users for due/overdue tasks,Medium,To Do,30-05-2025,Sable Quinn,Charlie White,22-04-2025,,,"Notifications,Mobile,Web",53,14,,0,Push Notifications,Notifications,Online,Online,,push_config.json,Medium,Hard to debug issues quickly.,Users missing reminders.,Add daily summary option.,Yes,28-05-2025,Design Status,Reminders
TASK443,Train Random Forest Model,Improve prediction for task urgency and success,High,To Do,10-06-2025,Mireille Vaughn,David Black,22-04-2025,,,"Machine Learning,AI",54,18,,0,Machine Learning Algorithms,AI Engine,Online,Local,,rf_model_v2.pkl,High,Hard to debug issues quickly.,Model overfits large tasks.,Balance dataset and tune parameters.,Yes,08-06-2025,Marketing Support Needed,AI Model
TASK444,Design Onboarding Flow,Create UI/UX designs for new user onboarding,Medium,To Do,01-06-2025,Fen Wayland,Charlie White,21-04-2025,,,"Design,UX,UI",26,15,,0,UX/UI Design,Design,Online,Online,,onboarding_wireframes.fig,Low,Hard to debug issues quickly.,User drop-off during onboarding.,Use progressive disclosure for onboarding.,Yes,30-05-2025,Analytics Tracked,User Journey
TASK445,Write Contributor Guidelines,Set clear rules for external contributors,Low,To Do,20-05-2025,Arlen Pierce,Eve Grey,22-04-2025,,,"Documentation,Open Source",15,6,,0,Technical Documentation,Documentation,Online,Online,,contrib_guide.md,Low,Hard to debug issues quickly.,PRs without descriptions.,Enforce templates and format rules.,Yes,18-05-2025,Retrospective Notes,Open Source
TASK446,Implement Task Export Feature,Allow export to CSV/Excel for reporting,Medium,To Do,05-06-2025,Galen Rivera,Jane Smith,22-04-2025,,,"Data Export,Reporting",22,10,,0,Backend Development,Development,Online,Online,,export_tasks_spec.pdf,Low,Hard to debug issues quickly.,Exported files lack time info.,Include timestamps and IDs.,Yes,03-06-2025,Dependency / Blocker,Utilities
TASK447,Audit User Permissions,Ensure role-based access across all modules,High,In Progress,25-05-2025,Tallulah Reed,Charlie White,22-04-2025,25-04-2025,"Security,Access Control",TASK038,14,5,45,Roles not enforced in some endpoints.,Role-Based Access Control (RBAC),Authorization,Online,Online,permissions_matrix.xlsx,None,High,Data leaks due to open access.,Review all routes and roles.,Yes,23-05-2025,#E91E63,Budget Impact,Permission Audit
TASK448,Build Chatbot Assistant,Guide users with an AI-powered assistant,High,To Do,15-06-2025,Xander Cole,Bob Green,22-04-2025,,,"AI,Chatbot,NLP",14,25,,0,Machine Learning Algorithms,AI Engine,Online,Online,,chatbot_flow.json,High,Data leaks due to open access.,Poor discovery of advanced features.,Add onboarding flows to chatbot.,Yes,13-06-2025,Target KPI,AI UX
TASK449,Translate UI to Spanish,Start i18n with Spanish translation,Medium,To Do,10-06-2025,Sylvie Drew,John Doe,22-04-2025,,,"Localization,i18n",6,10,,0,Multi-Language Support,Internationalization,Online,Online,,ui_spanish_strings.json,Low,Data leaks due to open access.,Only English supported currently.,Use dynamic string keys.,Yes,08-06-2025,Chat Assistant,Globalization
TASK450,Create Demo Video,Record a walkthrough video for new users,Low,To Do,28-05-2025,Navy Lennox,Jane Smith,22-04-2025,,,"Marketing,Tutorial",30,6,,0,Content Marketing,Marketing,Online,Online,,demo_script.docx,Low,Data leaks due to open access.,Low user engagement post-signup.,Embed on dashboard and emails.,Yes,26-05-2025,Spanish Translation,Marketing Assets
TASK451,Update Mobile App Store Listings,Refresh visuals and descriptions on Play Store/App Store,Low,To Do,01-06-2025,Aziel Monroe,David Black,22-04-2025,,,"Marketing,Mobile",16,8,,0,Content Marketing,Marketing,Online,Online,,store_listing_assets.zip,Low,Data leaks due to open access.,Outdated screenshots.,Add video and reviews.,Yes,30-05-2025,Demo Video,App Marketing
TASK452,Add Recurring Task Option,Allow users to set daily/weekly recurring tasks,High,To Do,08-06-2025,Caia Emerson,Charlie White,22-04-2025,,,"Features,Productivity",19,14,,0,Backend Development,Development,Online,Online,,recurring_task_design.pdf,Medium,Data leaks due to open access.,User frustration with manual repeats.,Support end/skip conditions.,Yes,06-06-2025,Store Update,New Features
TASK453,Analyze Task Drop-off Patterns,Use analytics to find where users abandon tasks,Medium,To Do,12-06-2025,Vaughn Tate,Alice Brown,22-04-2025,,,"Analytics,Behavior",10,10,,0,Data Analytics,Analytics,Online,Online,,dropoff_analysis.ipynb,Medium,Data leaks due to open access.,Low task completion rates.,Add alerts and nudges.,Yes,10-06-2025,Recurring Tasks,Engagement
TASK454,Enable Slack Integration,Sync tasks and reminders with Slack,High,To Do,18-06-2025,Ellery West,Charlie White,22-04-2025,,,"Integrations,Slack",50,16,,0,API Integration,Integrations,Online,Online,,slack_bot_script.js,High,Data leaks due to open access.,Missed updates in cross-team setups.,Add reminders and create-task from Slack.,Yes,16-06-2025,Task Analysis,Integrations
TASK455,Develop Analytics Dashboard,Create interactive charts for user insights,High,To Do,25-06-2025,Calliope James,Jane Smith,22-04-2025,,,Development,11,6,,analytics_dashboard_plan.xlsx,User Authentication,User Accounts,Online,Online,Yes,23-06-2025,High,Data leaks due to open access.,Dashboard V2,,,,Slack Sync,Approval Status
TASK456,Conduct Code Audit,Review code for maintainability and adherence to standards,Medium,To Do,20-06-2025,Torin Vale,Charlie White,22-04-2025,,,Development,12,30,,code_audit_guide.pdf,Content Marketing,Marketing,Online,Online,Yes,18-06-2025,Low,Engineering Audit,Code Standards,,,,Gantt Chart Updated,Launch Date
TASK457,Plan Feature Rollout,Strategize phased release of new productivity tool,High,In Progress,30-05-2025,Rhea Camden,Alice Brown,22-04-2025,25-04-2025,,,18,16,Online,,Task Scheduling,Development,Online,Online,Pilot with internal users first.,Yes,Low,Engineering Audit,Product Launch,Rollout Strategy,,,Data Validation Required,Completion Date
TASK458,Design Mobile Notifications,UX flow for push and in-app notifications,Medium,To Do,10-06-2025,Niko Sterling,Eve Grey,22-04-2025,,,UX Design,27,19,,notifications_wireframe.fig,User Authentication,Technical,Online,Online,Yes,08-06-2025,Low,Engineering Audit,Push UX,,,,Conversion Optimization,Time Spent
TASK459,Create Security Protocols,Outline data protection measures for user information,High,To Do,15-06-2025,Azaria Moon,David Black,22-04-2025,,,Security,6,10,,security_protocols_guide.docx,Content Marketing,System Administration,Online,Online,Yes,13-06-2025,Medium,Information Security,Data Policy,,,,Authorization,Time Remaining
TASK460,Deploy Chatbot to Production,Migrate AI chatbot to live environment,High,In Progress,29-05-2025,Lazaro Quinn,Bob Green,22-04-2025,24-04-2025,,,18,50,Online,,Backend Development,Database,Online,Online,Monitor logs and set alerts.,Yes,Medium,Information Security,Conversational UI,Live Chatbot,,,Version 2,Effort Estimate
TASK461,Design User Badges,Create icons and reward system for user engagement,Low,To Do,18-06-2025,Odette Flynn,Charlie White,22-04-2025,,,Gamification,23,11,,badges_sketch.fig,Software Development,Market Research,Online,Online,Yes,16-06-2025,High,User Rewards,Recognition Design,,,,KPI Dashboard,Risk Level
TASK462,Update User Terms,Revise user agreement to comply with new laws,Medium,To Do,25-06-2025,Bran Wilder,Eve Grey,22-04-2025,,,Legal,24,12,,updated_terms.docx,Server Management,Data Analytics,Online,Online,Yes,23-06-2025,High,Policy Update,Legal Terms,,,,Data Security,Impact Assessment
TASK463,Add Voice Input Feature,Enable voice-based task entry and search,High,To Do,20-06-2025,Yara Lennox,John Doe,22-04-2025,,,Accessibility,6,18,,voice_input_spec.pdf,Database Design,Project Management,Online,Online,Yes,18-06-2025,Low,Voice Features,Task Entry UX,,,,Competitor Landscape,Feature Owner
TASK464,Optimize Search Algorithm,Improve relevance and speed of in-app search,Medium,In Progress,10-06-2025,Cassidy Reed,Alice Brown,22-04-2025,26-04-2025,,,30,27,Online,,Competitive Analysis,User Accounts,Online,Online,Use indexing and caching.,Yes,Low,Voice Features,Search Optimization,Algorithm Upgrade,,,Data Insights,Version Control
TASK465,Train New Interns,Onboard summer interns with required tools and process knowledge,Low,To Do,05-06-2025,Eira Monroe,Jane Smith,22-04-2025,,,HR,16,6,,intern_training_plan.docx,Data Visualization,Marketing,Online,Online,Yes,03-06-2025,Low,Team Management,Intern Onboarding,,,,Sprint Retrospective,Release Type
TASK466,Configure SSO Integration,Enable Single Sign-On with Okta,High,To Do,12-06-2025,Jett Calder,Eve Grey,22-04-2025,,,IT,19,18,,sso_setup_guide.pdf,Task Tracking,Development,Online,Online,Yes,10-06-2025,Medium,Security,Login SSO,,,,CI/CD,Milestone Date
TASK467,Launch Product Blog,Create and publish posts related to new features and updates,Medium,To Do,25-06-2025,Ansel Gray,Charlie White,22-04-2025,,,Marketing,10,23,,blog_content_calendar.xlsx,Continuous Integration/Continuous Deployment (CI/CD),Technical,Online,Online,Yes,23-06-2025,Medium,Content Marketing,Feature Blog,,,,Feedback Analysis,Feature Status
TASK468,Improve Email Templates,Redesign emails for onboarding  reminders  and alerts,Medium,To Do,15-06-2025,Roux Emerson,David Black,22-04-2025,,,Design,50,24,,email_template_v2.fig,Unit Testing,System Administration,Online,Online,Yes,13-06-2025,High,Communication,Email UX,,,,Mobile App Project,Customer Feedback
TASK469,Implement 2FA,Add two-factor authentication to user login flow,High,In Progress,25-05-2025,Blaise Orion,John Doe,22-04-2025,27-04-2025,,,11,6,Online,,Backend Development,Database,Online,Online,Use time-based OTPs.,Yes,High,Communication,Security Layer,2FA,,,Sales Enablement,UX/UI Status
TASK470,User Survey for Feedback,Send out quarterly satisfaction survey,Low,To Do,22-06-2025,Solene Carter,Bob Green,22-04-2025,,,UX,12,30,,q2_user_survey.pdf,Lead Generation,Market Research,Online,Online,Yes,20-06-2025,Low,User Voice,Q2 Survey,,,,Sprint Planning,Legal Review
TASK471,Launch Beta Program,Invite users to test new features before launch,Medium,To Do,28-06-2025,Tallis Vaughn,John Doe,22-04-2025,,,Product,18,16,,beta_invite_list.csv,Task Tracking,Data Analytics,Online,Online,Yes,26-06-2025,Low,Feature Validation,Beta Run,,,,Gateway Integration,Security Review
TASK472,Build Notification Preferences,Allow users to customize alerts and messages,Medium,To Do,15-06-2025,Delano Rivers,Eve Grey,22-04-2025,,,UX,27,19,,notif_prefs_ui.fig,API Integration,Project Management,Online,Online,Yes,13-06-2025,Low,Settings UX,Notification Control,,,,User Journey,Internal Stakeholder
TASK473,Create Sales Enablement Kit,Prepare slides  scripts  and demos for the sales team,Medium,To Do,20-06-2025,Ismay Blake,Alice Brown,22-04-2025,,,Sales,6,10,,sales_kit.pptx,UX/UI Design,User Accounts,Online,Online,Yes,18-06-2025,Medium,Sales Support,Enablement Kit,,,,Real-Time Features,External Stakeholder
TASK474,Test Cross-Browser Compatibility,Ensure application works on Chrome,Medium,In Progress,12-06-2025,Neve Collins,David Black,22-04-2025,26-04-2025,,,18,50,Online,,Quality Control,Marketing,Online,Online,Automate regression tests.,Yes,Medium,Sales Support,Web Testing,Browser Checks,,,UI Refresh,Deployment Status
TASK475,Implement User Analytics,Track user engagement and behavior trends,High,To Do,28-06-2025,Aurelian Fox,Alice Brown,22-04-2025,,,Analytics,23,11,,user_analytics_spec.pdf,Data Dashboards,Development,Online,Online,Yes,26-06-2025,High,Engagement Tracking,User Metrics,,,,Campaign Planning,Testing Phase
TASK476,Update API Documentation,Refresh docs to reflect new endpoints and parameters,Medium,In Progress,18-06-2025,Thalassa Ray,Charlie White,22-04-2025,26-04-2025,,,24,12,Online,,Content Marketing,Technical,Online,Online,Version docs and auto-generate.,Yes,High,Engagement Tracking,Dev Support,API Docs V2,,,Internal Wiki,Development Stage
TASK477,Design Task Calendar View,Visualize tasks over time in a calendar UI,Medium,To Do,02-07-2025,Zephyrine Wren,David Black,22-04-2025,,,UX,6,18,,calendar_ui_design.fig,Intranet Development,System Administration,Online,Online,Yes,30-06-2025,Low,Task Planning,Timeline View,,,,Sprint 3 Review,Budget Spent
TASK478,Optimize Backend Queries,Reduce DB load by optimizing slow SQL calls,High,In Progress,22-06-2025,Loic Bennett,Bob Green,22-04-2025,27-04-2025,,,30,27,Online,,Usability Testing,Database,Online,Online,Use query analyzer tools.,Yes,Low,Task Planning,Performance,Database Tuning,,,Pipeline Setup,Budget Remaining
TASK479,Conduct Security Pen Test,Third-party penetration testing for vulnerabilities,High,To Do,10-07-2025,Zena Frost,Charlie White,22-04-2025,,,Security,16,6,,pen_test_agenda.pdf,Content Marketing,Market Research,Online,Online,Yes,08-07-2025,Low,App Security,Pentest 2025,,,,Round 2,Quality Score
TASK480,Build Notification Engine,Backend system for personalized task notifications,Medium,To Do,29-06-2025,Cyan Maddox,Jane Smith,22-04-2025,,,Backend,19,18,,notif_engine_spec.docx,Continuous Integration/Continuous Deployment (CI/CD),Data Analytics,Online,Online,Yes,27-06-2025,Medium,Systems,Notification Engine,,,,Performance Tuning,Support Ticket Number
TASK481,Run Load Test Suite,Stress test app for concurrency and response,Medium,To Do,20-06-2025,Odilon West,David Black,22-04-2025,,,QA,10,23,,load_test_plan.yaml,Backend Development,Project Management,Online,Online,Yes,18-06-2025,Medium,Load Testing,Stress Sim,,,,Collateral Update,Customer Satisfaction
TASK482,Enable Dark Mode,Implement light/dark theme toggle,Low,To Do,30-06-2025,Liora Sinclair,Eve Grey,22-04-2025,,,Frontend,50,24,,dark_mode_theme.fig,Process Optimization,User Accounts,Online,Online,Yes,28-06-2025,High,UI Options,Dark Theme,,,,Sprint 4,Marketing ROI
TASK483,Validate Email Deliverability,Ensure system emails reach inbox not spam,Medium,To Do,25-06-2025,Renzo Hayes,Charlie White,22-04-2025,,,Ops,11,6,,deliverability_test.xlsx,Resource Allocation,Marketing,Online,Online, DKIM, DMARC.,High,UI Options,#795548,Ops Tools,Email Check,,CI/CD,Deployment Date
TASK484,Configure CDN Caching,Improve asset delivery speed globally,High,To Do,18-06-2025,Sabine Parker,David Black,22-04-2025,,,Infrastructure,12,30,,cdn_config_steps.md,UX/UI Design,Development,Online,Online,Yes,16-06-2025,Low,Infrastructure,Asset Delivery,,,,Feedback Analysis,Task Duration
TASK485,Add Task Priority Filters,Enable filtering by priority on dashboard,Low,To Do,19-06-2025,Avian Rhodes,Eve Grey,22-04-2025,,,UX,18,16,,priority_filter_spec.fig,Machine Learning Algorithms,Technical,Online,Online,Yes,17-06-2025,Low,UX Features,Filter UX,,,,Mobile App Project,Team Collaboration Level
TASK486,Create System Health Monitor,Build dashboard showing uptime and metrics,High,In Progress,28-06-2025,Kairo Lane,Jane Smith,22-04-2025,28-04-2025,,,27,19,Online,,API Integration,System Administration,Online,Online,Set alerts for thresholds.,Yes,Low,UX Features,Monitoring,Health UI,,,Sales Enablement,User Growth Impact
TASK487,Launch Referral Program,Reward users for inviting new users,Medium,To Do,30-06-2025,Vesper Dean,John Doe,22-04-2025,,,Marketing,6,10,,referral_rules.docx,Content Marketing,Database,Online,Online,Yes,28-06-2025,Medium,User Growth,Referral Campaign,,,,Sprint Planning,Data Privacy Level
TASK488,Update Mobile UI Components,Use latest UI kit for consistency,Low,To Do,01-07-2025,Thorne Ellis,Alice Brown,22-04-2025,,,Mobile,18,50,,mobile_ui_kit_update.fig,Performance Monitoring,Market Research,Online,Online,Yes,29-06-2025,Medium,Mobile Design,UI Refresh,,,,Gateway Integration,Performance Metrics
TASK489,Analyze Task Completion Trends,Find patterns in how users complete tasks,Medium,To Do,03-07-2025,Azura Paige,Bob Green,22-04-2025,,,Analytics,23,11,,task_trend_analysis.csv,UX/UI Design,Data Analytics,Online,Online,Yes,01-07-2025,High,User Insights,Task Behavior,,,,User Journey,Documentation Status
TASK490,Automate Weekly Reports,Send automatic summary of completed tasks,Medium,To Do,23-06-2025,Marcellus Drake,David Black,22-04-2025,,,Automation,24,12,,weekly_report_script.py,Push Notifications,Project Management,Online,Online,Yes,21-06-2025,High,Reporting,Task Summary,,,,Real-Time Features,Customer Segment
TASK491,Refactor Legacy Code,Modernize old modules for maintainability,High,In Progress,27-06-2025,Soleil Grant,Alice Brown,22-04-2025,28-04-2025,,,6,18,Online,,Machine Learning Algorithms,User Accounts,Online,Online,Refactor in sprints.,Yes,Low,Reporting,Code Maintenance,Legacy Cleanup,,,UI Refresh,Growth Opportunity
TASK492,Setup Feedback Widget,Collect feedback from every page,Low,To Do,26-06-2025,Aris Monroe,Jane Smith,22-04-2025,,,UX,30,27,,widget_feedback_ui.fig,UX/UI Design,Marketing,Online,Online,Yes,24-06-2025,Low,User Feedback,Inline Widget,,,,Campaign Planning,Product Type
TASK493,Conduct User Interviews,Qualitative research for pain points,Medium,To Do,29-06-2025,Noor Campbell,Charlie White,22-04-2025,,,Research,16,6,,user_interview_guide.pdf,Technical Documentation,Development,Online,Online,Yes,27-06-2025,Low,User Research,Interview Round 2,,,,Internal Wiki,Service Level Agreement (SLA)
TASK494,Implement Role-Based Access,Control user permissions by role,High,To Do,05-07-2025,Brisa Vaughn,David Black,22-04-2025,,,Security,19,18,,rba_design_spec.pdf,Backend Development,Technical,Online,Online, User, Viewer.,Medium,User Research,#673AB7,Access Control,RBAC,,User Engagement,Product Lifecycle Stage
TASK495,Archive Inactive Tasks,Auto-archive old completed tasks,Low,To Do,24-06-2025,Hale Rowan,John Doe,22-04-2025,,,Product,10,23,,task_archive_policy.docx,Role-Based Access Control (RBAC),System Administration,Online,Online,Yes,22-06-2025,Medium,Task Clean-up,Archive Logic,,,,Search Marketing,Revenue Impact
TASK496,Introduce Smart Suggestions,Use ML to recommend next tasks,High,To Do,08-07-2025,Petra Wells,Bob Green,22-04-2025,,,AI,50,24,,smart_suggest_algo.pdf,Machine Learning Algorithms,Database,Online,Online,Yes,06-07-2025,High,Smart Assistant,AI Suggestions,,,,Feature Management,Feature Maturity
TASK497,QA Checklist Revision,Update test checklist with recent modules,Medium,To Do,21-06-2025,Alba Storm,Alice Brown,22-04-2025,,,QA,11,6,,qa_checklist_v2.xlsx,Multi-Language Support,Market Research,Online,Online,Yes,19-06-2025,High,Quality Assurance,Checklist Update,,,,Code Quality,User Adoption Rate
TASK498,Setup Weekly Standups,Automate calendar invites for team standups,Low,To Do,17-06-2025,Eamon Blake,Jane Smith,22-04-2025,,,Management,12,30,,standup_invites.ics,Content Marketing,Data Analytics,Online,Online,Yes,15-06-2025,Low,Team Rituals,Daily Sync,,,,DB Optimization,API Integration Status
TASK499,Localize UI for Spanish,Translate UI for Spanish users,Medium,To Do,06-07-2025,Sorrel Knox,Charlie White,22-04-2025,,,Localization,18,16,,spanish_locale.json,Content Marketing,Project Management,Online,Online,Yes,04-07-2025,Low,Global Reach,Spanish Version,,,,Productivity,Configuration Type
TASK500,Add Custom Task Fields,Allow users to define extra task metadata,Medium,To Do,02-07-2025,Leith Palmer,Eve Grey,22-04-2025,,,Customization,27,19,,custom_field_spec.docx,Backend Development,User Accounts,Online,Online, text, tags.,Low,Global Reach,#FF5722,User Customization,Task Fields,,Mobile Design,Access Level
TASK501,Enhance Onboarding Tour,Improve walkthrough for new users,Low,To Do,28-06-2025,Romilly Tate,Bob Green,22-04-2025,,,UX,6,10,,onboarding_flow_v3.fig,Data Analytics,Marketing,Online,Online,Yes,26-06-2025,Medium,User Onboarding,Tour V3,,,,Report Automation,Error Rate
TASK502,Sync with Google Calendar,Allow 2-way calendar sync,High,To Do,04-07-2025,Stella Dean  ,John Doe,22-04-2025,,,Integration,18,50,,gcal_sync_api.md,API Integration,Development,Online,Online,Yes,02-07-2025,Medium,Productivity,Calendar Sync,,,,UI Kit,Maintenance Window
TASK503,Setup Backup Schedule,Daily backups for user data,High,To Do,27-06-2025,Indira Skye,Charlie White,22-04-2025,,,Infrastructure,23,11,,backup_policy.docx,User Authentication,Technical,Online,Online,Yes,25-06-2025,High,System Safety,Data Backup,,,,Sentiment,User Retention Rate
TASK504,Review Team OKRs,Q2 review for alignment and progress,Medium,To Do,30-06-2025,Calder Briar,Alice Brown,22-04-2025,,,Management,24,12,,q2_okrs_review.docx,Content Marketing,System Administration,Online,Online,Yes,28-06-2025,High,Team Planning,Q2 Goals,,,,Chrome Plugin,Customer Acquisition Cost (CAC)
TASK505,Update Project Timeline,Revise the project schedule based on recent progress and roadblocks,High,In Progress,29-04-2025,Ziva Monroe,Jane Smith,18-04-2025,21-04-2025,"Project Planning,Timeline",TASK006,6,4,70,Need to incorporate feedback on staging deployment.,Scheduling - Task Scheduling,Scheduling,Online,Online,project_timeline_v2.mpp,None,Medium,Potential slippage due to deployment issues.,Re-evaluate dependencies and allocate buffer time.,Yes,27-04-2025,#FF8A65,Milestone Review,Gantt Chart Updated
TASK506,Develop User Profile Page,Implement the frontend and backend logic for user profile management,High,In Progress,05-05-2025,Toren Frost,Bob Green,18-04-2025,22-04-2025,"Development,Frontend,Backend",TASK017,30,25,83,Integrating with authentication service.,User Accounts - User Authentication,User Accounts,Local,Online,user_profile_schema.json,None,Low,Minor UI alignment issues.,Address during final testing.,Yes,03-05-2025,#4CAF50,Sprint 4,Data Validation Required
TASK507,Run A/B Tests on Landing Page,Experiment with different versions of the landing page to optimize conversion rates,Medium,To Do,12-05-2025,Amaris Quinn,Charlie White,18-04-2025,,,"Marketing,A/B Testing,Web",16,16,,0,Marketing - Content Marketing,Marketing,Local,Online,,landing_page_variants.pdf,Medium,Minor UI alignment issues.,Traffic volume might affect test duration.,Ensure sufficient traffic before concluding tests.,Yes,10-05-2025,UI Refresh,Conversion Optimization
