Task ID,Task Name,Description,Priority,Status,Due Date,Assigned To,Created By,Creation Date,Last Updated,Tags,Dependencies,Estimated Effort (Hours),Actual Effort (Hours),Completion Percentage,Notes,Category,Category,Location,Meeting Link,Attachments,Blockers,Risk Level,Risk Description,Resolution Plan,Notifications Enabled,Reminder Date,Color Code,Custom Field 1,Custom Field 2
TASK026,Update Project Timeline,Revise the project schedule based on recent progress and roadblocks,High,In Progress,29-04-2025,Alex Parker  ,Jane Smith,18-04-2025,21-04-2025,"Project Planning,Timeline",TASK006,6,4,70,Need to incorporate feedback on staging deployment.,Task Scheduling,Scheduling,Online,Online,project_timeline_v2.mpp,None,Medium,Potential slippage due to deployment issues.,Re-evaluate dependencies and allocate buffer time.,Yes,27-04-2025,#FF8A65,Milestone Review,Gantt Chart Updated
TASK027,Develop User Profile Page,Implement the frontend and backend logic for user profile management,High,In Progress,05-05-2025,Casey Morgan  ,Bob Green,18-04-2025,22-04-2025,"Development,Frontend,Backend",TASK017,30,25,83,Integrating with authentication service.,User Authentication,User Accounts,Local,Online,user_profile_schema.json,None,Low,Minor UI alignment issues.,Address during final testing.,Yes,03-05-2025,#4CAF50,Sprint 4,Data Validation Required
TASK028,Run A/B Tests on Landing Page,Experiment with different versions of the landing page to optimize conversion rates,Medium,To Do,12-05-2025,Jordan Lee  ,Charlie White,18-04-2025,,,"Marketing,A/B Testing,Web",16,16,,0,Content Marketing,Marketing,Local,Online,,landing_page_variants.pdf,Medium,Minor UI alignment issues.,Traffic volume might affect test duration.,Ensure sufficient traffic before concluding tests.,Yes,10-05-2025,UI Refresh,Conversion Optimization
TASK029,Implement Role-Based Access Control,Secure the application by implementing different access levels for various user roles,High,To Do,19-05-2025,Taylor Brooks  ,David Black,18-04-2025,,,"Development,Backend,Security",19,25,,0,Backend Development,Development,Local,Online,,rbac_design.docx,Medium,Minor UI alignment issues.,Potential security vulnerabilities if not implemented correctly.,Thorough testing and code review required.,Yes,17-05-2025,Sprint 4,Authorization
TASK030,Create API Documentation (v2),Update the API documentation to reflect the latest changes and new endpoints,Low,In Progress,26-05-2025,Avery Collins  ,Eve Grey,18-04-2025,23-04-2025,"Documentation,API",TASK012,10,7,75,Documenting the new authentication methods.,Software Development,Technical,Online,Online,api_spec_v2.yaml,None,Low,Keeping documentation up-to-date with development.,Automate documentation generation where possible.,Yes,24-05-2025,#9E9E9E,API Reference,Version 2
TASK031,Monitor System Performance,Continuously track key performance indicators (KPIs) of the application,Medium,Monitoring,02-06-2025,Riley Bennett  ,Alice Brown,19-04-2025,24-04-2025,"Operations,Monitoring,Performance",TASK021,50,Ongoing,90,Setting up alerts for critical thresholds.,Server Management,System Administration,Online,Online,monitoring_dashboard_link.url,None,Low,Potential for performance degradation over time.,Regular optimization and scaling efforts.,Yes,31-05-2025,#673AB7,System Health,KPI Dashboard
TASK032,Design Database Backup Strategy,Plan and document the procedures for regular database backups and recovery,Medium,To Do,09-06-2025,Quinn Harris  ,John Doe,19-04-2025,,,"Database,Backup,Recovery",11,8,,0,Database Design,Database,Online,Local,,backup_strategy_draft.docx,Medium,Potential for performance degradation over time.,Risk of data loss without a robust backup plan.,Implement and test backup and recovery procedures.,Yes,07-06-2025,Admin Tool,Data Security
TASK033,Conduct Competitive Analysis,Research and analyze the features and strategies of competitor products,Low,Completed,25-04-2025,Jamie Scott  ,John Doe,19-04-2025,23-04-2025,"Market Research,Analysis",,12,12,100,Compiled a report summarizing key findings.,Competitive Analysis,Market Research,Online,Local,competitive_analysis_report.pdf,None,Low,Data accuracy and completeness.,Cross-reference with multiple sources.,Yes,23-04-2025,#795548,Market Intelligence,Competitor Landscape
TASK034,Integrate Third-Party Analytics,Implement tracking and analytics tools to gather user behavior data,Medium,In Progress,16-05-2025,Cameron Ellis  ,Alice Brown,19-04-2025,25-04-2025,"Development,Analytics,Integration",TASK017,18,14,78,Configuring event tracking and custom reports.,Data Visualization,Data Analytics,Online,Local,analytics_integration_plan.docx,None,Low,Ensuring data privacy compliance.,Anonymize user data where necessary.,Yes,14-05-2025,#009688,User Tracking,Data Insights
TASK035,Prepare End-of-Sprint Report,Summarize the progress  achievements  and challenges of the current sprint,Medium,To Do,23-05-2025,Devin Clarke  ,Jane Smith,19-04-2025,,,"Agile,Reporting,Sprint",27,8,,0,Task Tracking,Project Management,Online,Online,,sprint_review_notes.docx,Low,Ensuring data privacy compliance.,Accurate representation of sprint outcomes.,Conduct a thorough sprint review meeting.,Yes,21-05-2025,Feature Type,Sprint Retrospective
TASK036,Automate Deployment Process,Implement scripts and tools to automate the application deployment pipeline,High,To Do,30-05-2025,Reese Monroe  ,Bob Green,20-04-2025,,,"DevOps,Automation,Deployment",6,20,,0,Continuous Integration/Continuous Deployment (CI/CD),DevOps,Online,Online,,deployment_scripts.zip,Medium,Ensuring data privacy compliance.,Potential for errors in automation scripts.,Thorough testing of the automation process.,Yes,28-05-2025,Priority,CI/CD
TASK037,Conduct User Interviews (Round 2),Follow up with users to gather more in-depth feedback on specific features,Medium,To Do,06-06-2025,Rowan James  ,Alice Brown,20-04-2025,,,"User Research,Interviews",18,12,,0,Unit Testing,Testing,Online,Remote,,interview_guide_round2.docx,Low,Ensuring data privacy compliance.,Scheduling conflicts with participants.,Offer flexible scheduling options.,Yes,04-06-2025,Department / Team,Feedback Analysis
TASK038,Optimize Mobile App Performance,Identify and implement performance improvements for the mobile application,Medium,To Do,13-06-2025,Skyler Patel  ,Bob Green,20-04-2025,,,"Development,Mobile,Performance",23,15,,0,Backend Development,Development,Online,Local,,mobile_profiling_report.pdf,Medium,Ensuring data privacy compliance.,Battery drain and slow loading times.,Optimize code and resource usage.,Yes,11-06-2025,Status,Mobile App Project
TASK039,Refine Sales Materials,Update brochures  presentations  and other sales collateral with the latest product information,Low,To Do,20-06-2025,Charlie Nguyen  ,Charlie White,20-04-2025,,,"Sales,Marketing Materials",24,10,,0,Lead Generation,Sales,Online,Local,,sales_brochure_draft.pdf,Low,Ensuring data privacy compliance.,Maintaining brand consistency.,Review all materials with the marketing team.,Yes,18-06-2025,Owner / Assignee,Sales Enablement
TASK040,Plan Next Sprint Backlog,Collaboratively define the tasks and priorities for the upcoming development sprint,High,To Do,28-05-2025,Dakota Evans  ,David Black,20-04-2025,,,"Agile,Planning,Sprint",35,8,,0,Task Tracking,Project Management,Online,Online,,sprint_planning_agenda.docx,Low,Ensuring data privacy compliance.,Ensuring clear and achievable sprint goals.,Conduct a well-facilitated sprint planning meeting.,Yes,26-05-2025,Sprint / Milestone,Sprint Planning
TASK041,Finalize Payment Gateway Integration,Complete setup and testing for the selected payment provider,High,In Progress,15-05-2025,Drew Campbell  ,Bob Green,21-04-2025,25-04-2025,"Development,Payments",TASK034,12,6,50,Pending validation from QA team.,API Integration,Integration,Online,Online,payment_gateway_config.docx,None,High,Incorrect configurations may lead to failed transactions.,Perform test transactions and monitor logs.,Yes,13-05-2025,#8BC34A,Tags / Labels,Gateway Integration
TASK042,Design Onboarding Flow,Create UI/UX designs for new user onboarding,Medium,To Do,01-06-2025,Logan West  ,Charlie White,21-04-2025,,,"Design,UX,UI",26,15,,0,UX/UI Design,Design,Online,Online,,onboarding_wireframes.fig,Low,Incorrect configurations may lead to failed transactions.,User drop-off during onboarding.,Use progressive disclosure for onboarding.,Yes,30-05-2025,Platform,User Journey
TASK043,Test WebSocket Implementation,Ensure real-time updates using WebSocket API are reliable,High,To Do,25-05-2025,Hayden Rivera  ,David Black,21-04-2025,,,"Testing,WebSocket,Real-Time",29,10,,0,Quality Control,QA,Online,Online,,websocket_test_plan.docx,Medium,Incorrect configurations may lead to failed transactions.,Failure to deliver messages in real-time.,Conduct stress testing and fallback plans.,Yes,23-05-2025,Impact Area,Real-Time Features
TASK044,Revamp Admin Dashboard,Improve usability and visibility of key metrics in the admin panel,High,In Progress,18-05-2025,Blake Kim  ,Bob Green,21-04-2025,24-04-2025,"UI/UX,Admin Panel",TASK030,20,10,50,Awaiting design review.,Data Dashboards,Dashboard,Online,Online,admin_dashboard_mockup.fig,None,Medium,Cluttered layout reduces usability.,Simplify layout and highlight KPIs.,Yes,16-05-2025,#CDDC39,Customer Facing,UI Refresh
TASK045,Create Marketing Calendar,Plan marketing campaigns and events for Q3 2025,Medium,To Do,10-06-2025,Jules Adams  ,Alice Brown,21-04-2025,,,"Marketing,Planning",13,10,,0,Content Marketing,Marketing,Online,Online,,marketing_calendar_q3.xlsx,Low,Cluttered layout reduces usability.,Overlap with product deadlines.,Coordinate with PMs and Sales.,Yes,08-06-2025,Estimated Effort,Campaign Planning
TASK046,Build Internal Wiki,Centralize knowledge base and documentation for internal teams,Low,In Progress,20-06-2025,Phoenix Ray  ,John Doe,21-04-2025,24-04-2025,"Knowledge Management,Documentation",TASK032,18,7,40,Structure outline is ready.,Intranet Development,Internal Tools,Online,Online,wiki_structure.md,None,Low,Duplicate documents across teams.,Standardize formats and templates.,Yes,18-06-2025,#9E9E9E,Release Version,Internal Wiki
TASK047,Integrate Feedback Widget,Add a floating feedback form on key screens,Medium,To Do,05-06-2025,Kai Walker  ,Charlie White,21-04-2025,,,"UX,Feedback,Forms",37,6,,0,Usability Testing,UX,Online,Online,,feedback_widget_design.fig,Low,Duplicate documents across teams.,Low engagement rate.,Use incentives and ensure visibility.,Yes,03-06-2025,Requires Validation,User Engagement
TASK048,Conduct SEO Audit,Review site structure and content for SEO improvements,Medium,To Do,31-05-2025,Robin Mitchell  ,Alice Brown,21-04-2025,,,"SEO,Audit,Marketing",12,8,,0,Content Marketing,Marketing,Online,Online,,seo_audit_report.docx,Medium,Duplicate documents across teams.,Low ranking for target keywords.,Revise meta tags and content strategy.,Yes,29-05-2025,Initiative Type,Search Marketing
TASK049,Set Up Feature Flag System,Enable toggling features for testing and phased releases,High,To Do,20-05-2025,Emerson Hayes  ,Eve Grey,21-04-2025,,,"DevOps,Release Control",36,14,,0,Continuous Integration/Continuous Deployment (CI/CD),DevOps,Online,Online,,feature_flags_setup.pdf,High,Duplicate documents across teams.,Live bugs due to incomplete toggles.,Test thoroughly in staging.,Yes,18-05-2025,Tech Stack / Integration,Feature Management
TASK050,Refactor Legacy Code,Improve performance and readability of outdated modules,Medium,To Do,15-06-2025,Lennox Carter  ,Bob Green,21-04-2025,,,"Development,Refactoring",28,25,,0,Backend Development,Development,Online,Online,,legacy_refactor_log.md,Medium,Duplicate documents across teams.,Risk of introducing bugs.,Incremental refactoring and code reviews.,Yes,13-06-2025,Use Case / Objective,Code Quality
TASK051,Optimize Database Indexes,Review and optimize slow DB queries,High,In Progress,01-06-2025,Marley Reed  ,David Black,22-04-2025,25-04-2025,"Database,Performance",TASK050,12,5,45,Indexes missing on key tables.,Process Optimization,Optimization,Online,Online,db_indexes_plan.sql,None,High,Slow task loading in dashboard.,Add composite indexes where needed.,Yes,30-05-2025,#4CAF50,Project Phase,DB Optimization
TASK052,Automate Daily Reports,Setup automation for daily team performance reports,Medium,To Do,28-05-2025,Jesse Sullivan  ,John Doe,22-04-2025,,,"Automation,Reporting",16,10,,0,Resource Allocation,Operations,Online,Online,,daily_report_script.py,Low,Slow task loading in dashboard.,Manual reports take too much time.,Use CRON and email delivery.,Yes,26-05-2025,Visibility,Productivity
TASK053,Design Mobile App UI,Create UI for iOS and Android versions,High,To Do,20-06-2025,Morgan Blake  ,Eve Grey,22-04-2025,,,"Design,Mobile",44,20,,0,UX/UI Design,Design,Online,Online,,mobile_app_ui.fig,High,Slow task loading in dashboard.,UI inconsistency across platforms.,Create reusable design components.,Yes,18-06-2025,Regulatory Impact,Mobile Design
TASK054,Implement Sentiment Analysis,Integrate ML model to analyze task sentiment,High,To Do,10-06-2025,Tatum Knight  ,Charlie White,22-04-2025,,,"AI,ML,NLP",8,15,,0,Machine Learning Algorithms,AI Engine,Online,Local,,sentiment_model.pkl,High,Slow task loading in dashboard.,Negative sentiment ignored in overdue tasks.,Flag tasks with negative emotions.,Yes,08-06-2025,Data Involved,AI Features
TASK055,Develop Chrome Extension,Enable task capture directly from browser,Medium,To Do,15-06-2025,Finley Turner  ,Jane Smith,22-04-2025,,,"Browser Extensions,Tools",10,16,,0,API Integration,Integrations,Online,Online,,chrome_ext_manifest.json,Medium,Slow task loading in dashboard.,Limited capture options.,Add smart capture and screenshot.,Yes,13-06-2025,Release Readiness,Extensions
TASK056,Host User Feedback Webinar,Gather insights from power users,Low,To Do,25-05-2025,Andy Jordan  ,Alice Brown,22-04-2025,,,"Community,Engagement",12,8,,0,Content Marketing,Marketing,Online,Online,,webinar_plan.pdf,Low,Slow task loading in dashboard.,Low turnout rate last time.,Promote via in-app banners.,Yes,23-05-2025,Customer Impact Level,Community Building
TASK057,Setup Error Logging System,Centralize all error reports and logs,High,In Progress,22-05-2025,Remy Bell  ,David Black,22-04-2025,24-04-2025,"Monitoring,Logging",TASK041,10,3,40,Stack traces inconsistent.,Performance Monitoring,Monitoring,Online,Online,log_config.yaml,None,High,Hard to debug issues quickly.,Use structured logging format.,Yes,20-05-2025,#F44336,Testing Required,Logs
TASK058,Redesign Settings Page,Improve usability and layout of account settings,Medium,To Do,05-06-2025,Daniel Murphy  ,Bob Green,22-04-2025,,,"UI/UX,Settings",40,12,,0,UX/UI Design,Design,Online,Online,,settings_page.fig,Low,Hard to debug issues quickly.,Too many options on one screen.,Group features into categories.,Yes,03-06-2025,Persona / User Role,UI Revamp
TASK059,Add Push Notification Support,Notify users for due/overdue tasks,Medium,To Do,30-05-2025,Michael Grant  ,Charlie White,22-04-2025,,,"Notifications,Mobile,Web",53,14,,0,Push Notifications,Notifications,Online,Online,,push_config.json,Medium,Hard to debug issues quickly.,Users missing reminders.,Add daily summary option.,Yes,28-05-2025,Design Status,Reminders
TASK060,Train Random Forest Model,Improve prediction for task urgency and success,High,To Do,10-06-2025,Ryan Webb  ,David Black,22-04-2025,,,"Machine Learning,AI",54,18,,0,Machine Learning Algorithms,AI Engine,Online,Local,,rf_model_v2.pkl,High,Hard to debug issues quickly.,Model overfits large tasks.,Balance dataset and tune parameters.,Yes,08-06-2025,Marketing Support Needed,AI Model
TASK025,Design Onboarding Flow,Create UI/UX designs for new user onboarding,Medium,To Do,01-06-2025,David Ross  ,Charlie White,21-04-2025,,,"Design,UX,UI",26,15,,0,UX/UI Design,Design,Online,Online,,onboarding_wireframes.fig,Low,Hard to debug issues quickly.,User drop-off during onboarding.,Use progressive disclosure for onboarding.,Yes,30-05-2025,Analytics Tracked,User Journey
TASK061,Write Contributor Guidelines,Set clear rules for external contributors,Low,To Do,20-05-2025,Ethan Brooks  ,Eve Grey,22-04-2025,,,"Documentation,Open Source",15,6,,0,Technical Documentation,Documentation,Online,Online,,contrib_guide.md,Low,Hard to debug issues quickly.,PRs without descriptions.,Enforce templates and format rules.,Yes,18-05-2025,Retrospective Notes,Open Source
TASK062,Implement Task Export Feature,Allow export to CSV/Excel for reporting,Medium,To Do,05-06-2025,Samuel Clark  ,Jane Smith,22-04-2025,,,"Data Export,Reporting",22,10,,0,Backend Development,Development,Online,Online,,export_tasks_spec.pdf,Low,Hard to debug issues quickly.,Exported files lack time info.,Include timestamps and IDs.,Yes,03-06-2025,Dependency / Blocker,Utilities
TASK063,Audit User Permissions,Ensure role-based access across all modules,High,In Progress,25-05-2025,Benjamin Hayes  ,Charlie White,22-04-2025,25-04-2025,"Security,Access Control",TASK038,14,5,45,Roles not enforced in some endpoints.,Role-Based Access Control (RBAC),Authorization,Online,Online,permissions_matrix.xlsx,None,High,Data leaks due to open access.,Review all routes and roles.,Yes,23-05-2025,#E91E63,Budget Impact,Permission Audit
TASK064,Build Chatbot Assistant,Guide users with an AI-powered assistant,High,To Do,15-06-2025,Jacob Perry  ,Bob Green,22-04-2025,,,"AI,Chatbot,NLP",14,25,,0,Machine Learning Algorithms,AI Engine,Online,Online,,chatbot_flow.json,High,Data leaks due to open access.,Poor discovery of advanced features.,Add onboarding flows to chatbot.,Yes,13-06-2025,Target KPI,AI UX
TASK065,Translate UI to Spanish,Start i18n with Spanish translation,Medium,To Do,10-06-2025,Lucas Marshall  ,John Doe,22-04-2025,,,"Localization,i18n",6,10,,0,Multi-Language Support,Internationalization,Online,Online,,ui_spanish_strings.json,Low,Data leaks due to open access.,Only English supported currently.,Use dynamic string keys.,Yes,08-06-2025,Chat Assistant,Globalization
TASK066,Create Demo Video,Record a walkthrough video for new users,Low,To Do,28-05-2025,Nathan Greene  ,Jane Smith,22-04-2025,,,"Marketing,Tutorial",30,6,,0,Content Marketing,Marketing,Online,Online,,demo_script.docx,Low,Data leaks due to open access.,Low user engagement post-signup.,Embed on dashboard and emails.,Yes,26-05-2025,Spanish Translation,Marketing Assets
TASK067,Update Mobile App Store Listings,Refresh visuals and descriptions on Play Store/App Store,Low,To Do,01-06-2025,Isaac Wells  ,David Black,22-04-2025,,,"Marketing,Mobile",16,8,,0,Content Marketing,Marketing,Online,Online,,store_listing_assets.zip,Low,Data leaks due to open access.,Outdated screenshots.,Add video and reviews.,Yes,30-05-2025,Demo Video,App Marketing
TASK068,Add Recurring Task Option,Allow users to set daily/weekly recurring tasks,High,To Do,08-06-2025,Matthew Boyd  ,Charlie White,22-04-2025,,,"Features,Productivity",19,14,,0,Backend Development,Development,Online,Online,,recurring_task_design.pdf,Medium,Data leaks due to open access.,User frustration with manual repeats.,Support end/skip conditions.,Yes,06-06-2025,Store Update,New Features
TASK069,Analyze Task Drop-off Patterns,Use analytics to find where users abandon tasks,Medium,To Do,12-06-2025,Andrew Palmer  ,Alice Brown,22-04-2025,,,"Analytics,Behavior",10,10,,0,Data Analytics,Analytics,Online,Online,,dropoff_analysis.ipynb,Medium,Data leaks due to open access.,Low task completion rates.,Add alerts and nudges.,Yes,10-06-2025,Recurring Tasks,Engagement
TASK070,Enable Slack Integration,Sync tasks and reminders with Slack,High,To Do,18-06-2025,Noah Curtis  ,Charlie White,22-04-2025,,,"Integrations,Slack",50,16,,0,API Integration,Integrations,Online,Online,,slack_bot_script.js,High,Data leaks due to open access.,Missed updates in cross-team setups.,Add reminders and create-task from Slack.,Yes,16-06-2025,Task Analysis,Integrations
TASK071,Develop Analytics Dashboard,Create interactive charts for user insights,High,To Do,25-06-2025,Christopher Dean  ,Jane Smith,22-04-2025,,,Development,11,6,,analytics_dashboard_plan.xlsx,User Authentication,User Accounts,Online,Online,Yes,23-06-2025,High,Data leaks due to open access.,Dashboard V2,,,,Slack Sync,Approval Status
TASK072,Conduct Code Audit,Review code for maintainability and adherence to standards,Medium,To Do,20-06-2025,Tyler Ford  ,Charlie White,22-04-2025,,,Development,12,30,,code_audit_guide.pdf,Content Marketing,Marketing,Online,Online,Yes,18-06-2025,Low,Engineering Audit,Code Standards,,,,Gantt Chart Updated,Launch Date
TASK073,Plan Feature Rollout,Strategize phased release of new productivity tool,High,In Progress,30-05-2025,Jonathan Hayes  ,Alice Brown,22-04-2025,25-04-2025,,,18,16,Online,,Task Scheduling,Development,Online,Online,Pilot with internal users first.,Yes,Low,Engineering Audit,Product Launch,Rollout Strategy,,,Data Validation Required,Completion Date
TASK074,Design Mobile Notifications,UX flow for push and in-app notifications,Medium,To Do,10-06-2025,Joshua Barrett  ,Eve Grey,22-04-2025,,,UX Design,27,19,,notifications_wireframe.fig,User Authentication,Technical,Online,Online,Yes,08-06-2025,Low,Engineering Audit,Push UX,,,,Conversion Optimization,Time Spent
TASK075,Create Security Protocols,Outline data protection measures for user information,High,To Do,15-06-2025,Adam Norris  ,David Black,22-04-2025,,,Security,6,10,,security_protocols_guide.docx,Content Marketing,System Administration,Online,Online,Yes,13-06-2025,Medium,Information Security,Data Policy,,,,Authorization,Time Remaining
TASK076,Deploy Chatbot to Production,Migrate AI chatbot to live environment,High,In Progress,29-05-2025,Caleb Dalton  ,Bob Green,22-04-2025,24-04-2025,,,18,50,Online,,Backend Development,Database,Online,Online,Monitor logs and set alerts.,Yes,Medium,Information Security,Conversational UI,Live Chatbot,,,Version 2,Effort Estimate
TASK077,Design User Badges,Create icons and reward system for user engagement,Low,To Do,18-06-2025,Zachary Blake  ,Charlie White,22-04-2025,,,Gamification,23,11,,badges_sketch.fig,Software Development,Market Research,Online,Online,Yes,16-06-2025,High,User Rewards,Recognition Design,,,,KPI Dashboard,Risk Level
TASK078,Update User Terms,Revise user agreement to comply with new laws,Medium,To Do,25-06-2025,Owen Chambers  ,Eve Grey,22-04-2025,,,Legal,24,12,,updated_terms.docx,Server Management,Data Analytics,Online,Online,Yes,23-06-2025,High,Policy Update,Legal Terms,,,,Data Security,Impact Assessment
TASK079,Add Voice Input Feature,Enable voice-based task entry and search,High,To Do,20-06-2025,Thomas Holt  ,John Doe,22-04-2025,,,Accessibility,6,18,,voice_input_spec.pdf,Database Design,Project Management,Online,Online,Yes,18-06-2025,Low,Voice Features,Task Entry UX,,,,Competitor Landscape,Feature Owner
TASK080,Optimize Search Algorithm,Improve relevance and speed of in-app search,Medium,In Progress,10-06-2025,Elijah Briggs  ,Alice Brown,22-04-2025,26-04-2025,,,30,27,Online,,Competitive Analysis,User Accounts,Online,Online,Use indexing and caching.,Yes,Low,Voice Features,Search Optimization,Algorithm Upgrade,,,Data Insights,Version Control
TASK081,Train New Interns,Onboard summer interns with required tools and process knowledge,Low,To Do,05-06-2025,Henry Lowe  ,Jane Smith,22-04-2025,,,HR,16,6,,intern_training_plan.docx,Data Visualization,Marketing,Online,Online,Yes,03-06-2025,Low,Team Management,Intern Onboarding,,,,Sprint Retrospective,Release Type
TASK082,Configure SSO Integration,Enable Single Sign-On with Okta,High,To Do,12-06-2025,Aiden Fox  ,Eve Grey,22-04-2025,,,IT,19,18,,sso_setup_guide.pdf,Task Tracking,Development,Online,Online,Yes,10-06-2025,Medium,Security,Login SSO,,,,CI/CD,Milestone Date
TASK083,Launch Product Blog,Create and publish posts related to new features and updates,Medium,To Do,25-06-2025,Jack Ramsey  ,Charlie White,22-04-2025,,,Marketing,10,23,,blog_content_calendar.xlsx,Continuous Integration/Continuous Deployment (CI/CD),Technical,Online,Online,Yes,23-06-2025,Medium,Content Marketing,Feature Blog,,,,Feedback Analysis,Feature Status
TASK084,Improve Email Templates,Redesign emails for onboarding  reminders  and alerts,Medium,To Do,15-06-2025,Leo Cross  ,David Black,22-04-2025,,,Design,50,24,,email_template_v2.fig,Unit Testing,System Administration,Online,Online,Yes,13-06-2025,High,Communication,Email UX,,,,Mobile App Project,Customer Feedback
TASK085,Implement 2FA,Add two-factor authentication to user login flow,High,In Progress,25-05-2025,Dylan Sharp  ,John Doe,22-04-2025,27-04-2025,,,11,6,Online,,Backend Development,Database,Online,Online,Use time-based OTPs.,Yes,High,Communication,Security Layer,2FA,,,Sales Enablement,UX/UI Status
TASK086,User Survey for Feedback,Send out quarterly satisfaction survey,Low,To Do,22-06-2025,Aaron McCoy  ,Bob Green,22-04-2025,,,UX,12,30,,q2_user_survey.pdf,Lead Generation,Market Research,Online,Online,Yes,20-06-2025,Low,User Voice,Q2 Survey,,,,Sprint Planning,Legal Review
TASK087,Launch Beta Program,Invite users to test new features before launch,Medium,To Do,28-06-2025,Cole Preston  ,John Doe,22-04-2025,,,Product,18,16,,beta_invite_list.csv,Task Tracking,Data Analytics,Online,Online,Yes,26-06-2025,Low,Feature Validation,Beta Run,,,,Gateway Integration,Security Review
TASK088,Build Notification Preferences,Allow users to customize alerts and messages,Medium,To Do,15-06-2025,Eric Vaughn  ,Eve Grey,22-04-2025,,,UX,27,19,,notif_prefs_ui.fig,API Integration,Project Management,Online,Online,Yes,13-06-2025,Low,Settings UX,Notification Control,,,,User Journey,Internal Stakeholder
TASK089,Create Sales Enablement Kit,Prepare slides  scripts  and demos for the sales team,Medium,To Do,20-06-2025,Emily Taylor  ,Alice Brown,22-04-2025,,,Sales,6,10,,sales_kit.pptx,UX/UI Design,User Accounts,Online,Online,Yes,18-06-2025,Medium,Sales Support,Enablement Kit,,,,Real-Time Features,External Stakeholder
